{
  "content_id": "3631309f-b9c0-4942-afe6-3ae3819fc6a1",
  "base_path": "/cma-cases",
  "format": "finder",
  "locale": "en",
  "public_updated_at": "2015-04-30T10:41:26.000+00:00",
  "publishing_app": "specialist-publisher",
  "rendering_app": "finder-frontend",
  "update_type": "major",
  "links": {
    "organisations": [
      "3338f283-64a1-4062-842e-677f520c1f15"
    ],
    "related": [],
    "email_alert_signup": [
      "5c35b119-aebc-4ec8-9413-370bd01c24b3"
    ]
  },
  "routes": [
    {
      "path": "/cma-cases",
      "type": "exact"
    }
  ]
}
